{
  "id": "atkore.p1000.page-20261021",
  "publisher": "atkore",
  "title": "P1000 - 1-5/8 x 1-5/8, 12 Gauge Channel, Solid",
  "canonicalUrl": "https://www.atkore.com/en-ca/products/strut-and-fittings/p1000",
  "documentVersion": null,
  "retrievedAt": "2026-10-22T02:30:52.234Z",
  "sha256": null,
  "accessStatus": "public",
  "lifecycleStatus": "unknown",
  "verification": {
    "status": "parsed"
  },
  "codeRefs": []
}
