{
  "id": "awc.nds-2024.reference",
  "publisher": "American Wood Council",
  "title": "2024 NDS Supplement",
  "canonicalUrl": "https://awc.org/resources/2024-nds-supplement/",
  "documentVersion": "2024",
  "retrievedAt": "2026-10-22T02:35:10.791Z",
  "sha256": null,
  "accessStatus": "unknown",
  "lifecycleStatus": "unknown",
  "verification": {
    "status": "discovered"
  },
  "codeRefs": []
}
