{
  "id": "hilti.kb-tz2-ss316.official-source",
  "publisher": "hilti",
  "title": "kb-tz2-ss316 official source",
  "canonicalUrl": "https://www.hilti.ca/c/CLS_FASTENER_7135/CLS_MECHANICAL_ANCHORS_7135/r8863109",
  "accessStatus": "unknown",
  "lifecycleStatus": "unknown",
  "verification": {
    "status": "discovered"
  },
  "sha256": null,
  "retrievedAt": null,
  "documentVersion": null,
  "codeRefs": []
}
