{
  "id": "hilti.kb-tz2-ss316.page-20261021",
  "publisher": "hilti",
  "title": "Kwik Bolt TZ2 Wedge anchor SS316",
  "canonicalUrl": "https://www.hilti.ca/c/CLS_FASTENER_7135/CLS_MECHANICAL_ANCHORS_7135/r8863109",
  "documentVersion": null,
  "retrievedAt": "2026-10-22T02:30:52.234Z",
  "sha256": null,
  "accessStatus": "public",
  "lifecycleStatus": "unknown",
  "verification": {
    "status": "parsed"
  },
  "codeRefs": []
}
