{
  "id": "simpson-strong-tie.strong-bolt-2.official-source",
  "publisher": "simpson-strong-tie",
  "title": "strong-bolt-2 official source",
  "canonicalUrl": "https://www.strongtie.com/products/anchoring-systems/strong-bolt2",
  "accessStatus": "unknown",
  "lifecycleStatus": "unknown",
  "verification": {
    "status": "discovered"
  },
  "sha256": null,
  "retrievedAt": null,
  "documentVersion": null,
  "codeRefs": []
}
