{
  "id": "astm.a992-06a.reference",
  "publisher": "ASTM International",
  "title": "Standard Specification for Structural Steel Shapes",
  "canonicalUrl": "https://store.astm.org/a0992_a0992m-06a.html",
  "documentVersion": "2006a (historical reference)",
  "retrievedAt": "2026-10-22T02:35:10.791Z",
  "sha256": null,
  "accessStatus": "unknown",
  "lifecycleStatus": "unknown",
  "verification": {
    "status": "discovered"
  },
  "codeRefs": []
}
