{
  "id": "weyerhaeuser.design-values.page-20261021",
  "publisher": "weyerhaeuser",
  "title": "Product Design Values",
  "canonicalUrl": "https://www.techsupport.weyerhaeuser.com/hc/en-us/articles/201758310-Product-Design-Values",
  "documentVersion": null,
  "retrievedAt": "2026-10-22T02:30:52.234Z",
  "sha256": null,
  "accessStatus": "public",
  "lifecycleStatus": "unknown",
  "verification": {
    "status": "parsed"
  },
  "codeRefs": []
}
