{
  "id": "csa.o86-24.reference",
  "publisher": "CSA Group",
  "title": "CSA O86:24 — Engineering design in wood",
  "canonicalUrl": "https://www.csagroup.org/store/product/2431021/",
  "documentVersion": "2024",
  "retrievedAt": "2026-10-22T02:35:10.791Z",
  "sha256": null,
  "accessStatus": "unknown",
  "lifecycleStatus": "unknown",
  "verification": {
    "status": "discovered"
  },
  "codeRefs": []
}
