{
  "id": "sdi.aisi-s100-2024.reference",
  "publisher": "Steel Deck Institute",
  "title": "Steel Deck Institute Announces New Edition of AISI S100 Standard for Cold-Formed Steel",
  "canonicalUrl": "https://sdi.org/resources/news-and-blog/steel-deck-institute-announces-new-edition-of-aisi-s100-standard-for-cold-formed-steel/",
  "documentVersion": "2025-03-05",
  "retrievedAt": "2026-10-22T02:35:10.791Z",
  "sha256": null,
  "accessStatus": "public",
  "lifecycleStatus": "unknown",
  "verification": {
    "status": "parsed"
  },
  "codeRefs": []
}
