{
  "id": "weyerhaeuser.engineered-wood.page-20261021",
  "publisher": "weyerhaeuser",
  "title": "Engineered Lumber",
  "canonicalUrl": "https://www.weyerhaeuser.com/woodproducts/engineered-wood/",
  "documentVersion": null,
  "retrievedAt": "2026-10-22T02:30:52.234Z",
  "sha256": null,
  "accessStatus": "public",
  "lifecycleStatus": "unknown",
  "verification": {
    "status": "parsed"
  },
  "codeRefs": []
}
