{
  "id": "canam.p3615-p3606.official-source",
  "publisher": "canam",
  "title": "p3615-p3606 official source",
  "canonicalUrl": "https://www.canam.com/wp-content/uploads/2024/07/p3606-p3615-composite-steel-deck-50-ksi-lsd-canada-canam.pdf",
  "accessStatus": "unknown",
  "lifecycleStatus": "unknown",
  "verification": {
    "status": "discovered"
  },
  "sha256": null,
  "retrievedAt": null,
  "documentVersion": null,
  "codeRefs": []
}
