{
  "id": "simpson-strong-tie.stb2.page-20261021",
  "publisher": "simpson-strong-tie",
  "title": "Strong-Bolt 2 Wedge Anchor",
  "canonicalUrl": "https://www.strongtie.com/products/anchoring-systems/strong-bolt2",
  "documentVersion": null,
  "retrievedAt": "2026-10-22T02:30:52.234Z",
  "sha256": null,
  "accessStatus": "public",
  "lifecycleStatus": "unknown",
  "verification": {
    "status": "parsed"
  },
  "codeRefs": []
}
