{
  "id": "canam.deck-transition.2024",
  "publisher": "canam",
  "title": "Steel deck: updates and new products coming soon!",
  "canonicalUrl": "https://www.canam.com/en/news/steel-deck-updates-and-new-products-coming-soon/",
  "documentVersion": "2024-08-07",
  "retrievedAt": "2026-10-22T02:30:52.234Z",
  "sha256": null,
  "accessStatus": "public",
  "lifecycleStatus": "unknown",
  "verification": {
    "status": "parsed"
  },
  "codeRefs": []
}
