{
  "id": "canam.hambro.page-20261021",
  "publisher": "Canam",
  "title": "Hambro Composite Floor System",
  "canonicalUrl": "https://www.canam.com/en/product/hambro-composite-floor-system/",
  "documentVersion": null,
  "retrievedAt": "2026-10-22T02:35:10.791Z",
  "sha256": null,
  "accessStatus": "public",
  "lifecycleStatus": "unknown",
  "verification": {
    "status": "parsed"
  },
  "codeRefs": []
}
